{
  "$schema": "https://json-schema.org/draft/2020-12/schema",
  "title": "社区便民服务缺口裁决台领域事件",
  "type": "object",
  "required": [
    "event_id",
    "event_type",
    "aggregate_type",
    "aggregate_id",
    "occurred_at",
    "version",
    "payload"
  ],
  "properties": {
    "event_id": {
      "type": "string",
      "minLength": 1
    },
    "event_type": {
      "type": "string",
      "enum": [
        "BOUNDARY_PUBLISHED",
        "NEED_AGGREGATED",
        "SITE_PROPOSED",
        "SITE_STATUS_CHANGED",
        "FUND_ROUND_OPENED",
        "FUND_RESERVED",
        "COVERAGE_REVIEWED",
        "DECISION_VERIFIED",
        "SITE_VERIFIED",
        "CONSENT_WITHDRAWN"
      ]
    },
    "aggregate_type": {
      "type": "string",
      "enum": [
        "community_revision",
        "service_need",
        "provider_site",
        "coverage_decision",
        "funding_round"
      ]
    },
    "aggregate_id": {
      "type": "string",
      "minLength": 1
    },
    "occurred_at": {
      "type": "string",
      "format": "date-time"
    },
    "version": {
      "type": "integer",
      "minimum": 1
    },
    "payload": {
      "type": "object"
    }
  },
  "payload_required_by_event": {
    "BOUNDARY_PUBLISHED": [
      "community_id",
      "revision",
      "zones"
    ],
    "NEED_AGGREGATED": [
      "community_id",
      "community_revision",
      "category",
      "zone",
      "time_window",
      "support_total"
    ],
    "SITE_PROPOSED": [
      "applicant_id",
      "categories",
      "community_id",
      "zone",
      "service_area",
      "capacity",
      "opens_at",
      "closes_at"
    ],
    "SITE_STATUS_CHANGED": [
      "status"
    ],
    "FUND_ROUND_OPENED": [
      "total_budget"
    ],
    "FUND_RESERVED": [
      "funding_round",
      "amount"
    ],
    "COVERAGE_REVIEWED": [
      "community_id",
      "community_revision",
      "category",
      "outcome",
      "reviewer",
      "safety_review_passed"
    ],
    "DECISION_VERIFIED": [
      "evidence_set",
      "verified_by"
    ],
    "SITE_VERIFIED": [
      "evidence_set",
      "verified_by"
    ],
    "CONSENT_WITHDRAWN": [
      "resident_ref"
    ]
  },
  "additionalProperties": false
}
